{
  "schema": "ingen.hammond-governance/v1",
  "record_id": "document-pipeline-v2",
  "contract": {
    "project_id": "document-pipeline",
    "id": "document-pipeline",
    "version": 2,
    "schema": "ingen.contract/v1",
    "artifact": {
      "uri": "hammond/examples/document-pipeline/contract-v2.canonical.json",
      "sha256": "6b40dfb15fa67f96c9f3bc79bc46206d45f6d44124197b344757499299e43445"
    }
  },
  "policy": {
    "id": "single-approval",
    "version": 1,
    "schema": "ingen.hammond-review-policy/v1",
    "artifact": {
      "uri": "hammond/examples/review-policy-v1.json",
      "sha256": "c80517e8aa51ca1715fc5e1214b2222aa99ed5fa286aee9f7340814c39caac10"
    }
  },
  "state": "registered",
  "events": [
    {
      "id": "event-001",
      "type": "registered",
      "actor": "contract-owner",
      "at": "2026-09-15T00:00:00Z"
    }
  ]
}
