{
  "schema": "ingen.hammond-governance/v1",
  "record_id": "document-pipeline-v2-solo",
  "contract": {
    "project_id": "document-pipeline",
    "id": "document-pipeline",
    "version": 2,
    "schema": "ingen.contract/v1",
    "artifact": {
      "uri": "hammond/examples/document-pipeline/contract-v2.canonical.json",
      "sha256": "6b40dfb15fa67f96c9f3bc79bc46206d45f6d44124197b344757499299e43445"
    }
  },
  "policy": {
    "id": "solo-approval",
    "version": 1,
    "schema": "ingen.hammond-review-policy/v1",
    "artifact": {
      "uri": "hammond/examples/solo/review-policy-v1.json",
      "sha256": "42813c913aafa55b6f47beec7ee3845cf25dad943fe6aebe72e4cfbb2f86203d"
    }
  },
  "state": "registered",
  "events": [
    {
      "id": "solo-event-001",
      "type": "registered",
      "actor": "solo",
      "at": "2026-09-15T00:00:00Z"
    }
  ]
}
