{
  "schema": "ingen.hammond-governance/v1",
  "record_id": "ecosystem-http-test-only",
  "contract": {
    "project_id": "document_flow",
    "id": "document_flow",
    "version": 2,
    "schema": "ingen.contract/v1",
    "artifact": {
      "uri": ".ingen/contract/sealed/canonical.json",
      "sha256": "@CONTRACT_SHA256@"
    }
  },
  "policy": {
    "id": "ecosystem-http-test-approval",
    "version": 1,
    "schema": "ingen.hammond-review-policy/v1",
    "artifact": {
      "uri": ".ingen/governance/review-policy.json",
      "sha256": "@POLICY_SHA256@"
    }
  },
  "state": "approved",
  "events": [
    {
      "id": "ecosystem-http-test-registered",
      "type": "registered",
      "actor": "acceptance-fixture",
      "at": "2026-10-04T00:00:00Z"
    },
    {
      "id": "ecosystem-http-test-review-opened",
      "type": "review-opened",
      "actor": "acceptance-fixture",
      "at": "2026-10-04T00:01:00Z",
      "review_cycle_id": "ecosystem-http-test-review-1"
    },
    {
      "id": "ecosystem-http-test-approved",
      "type": "approval-recorded",
      "actor": "acceptance-fixture",
      "role": "product-reviewer",
      "review_cycle_id": "ecosystem-http-test-review-1",
      "decision": "approve",
      "artifact_sha256": "@CONTRACT_SHA256@",
      "at": "2026-10-04T00:02:00Z"
    }
  ]
}
